request_id,query
req_001,What is artificial intelligence and how does it work?
req_002,Explain machine learning in simple terms with examples.
req_003,How do solar panels convert sunlight into electricity?
req_004,What are the main benefits of renewable energy sources?
req_005,Describe the difference between AI and machine learning.
req_006,How does blockchain technology ensure data security?
req_007,What is cloud computing and why is it important?
req_008,Explain quantum computing and its potential applications.
req_009,What are the most popular programming languages in 2024?
req_010,How does the Internet of Things (IoT) work?
req_011,What is cybersecurity and why is it crucial for businesses?
req_012,Explain the concept of big data and its applications.
req_013,How do neural networks function in deep learning?
req_014,What are the advantages of electric vehicles over gas cars?
req_015,Describe how 5G technology differs from 4G networks.
req_016,What is virtual reality and how is it used in education?
req_017,How does natural language processing enable chatbots?
req_018,What are the environmental benefits of wind energy?
req_019,Explain how autonomous vehicles navigate roads safely.
req_020,What is edge computing and how does it complement cloud computing?
req_021,How do recommendation systems work on streaming platforms?
req_022,What are the key principles of sustainable development?
req_023,Explain the role of APIs in modern software development.
req_024,How does facial recognition technology work?
req_025,What are the main components of a smart city?
req_026,Describe the process of photosynthesis in plants.
req_027,How do search engines rank web pages in results?
req_028,What is the greenhouse effect and its impact on climate?
req_029,Explain how GPS technology determines location accurately.
req_030,What are the health benefits of regular exercise?
req_031,How do vaccines work to prevent diseases?
req_032,What is the water cycle and why is it important?
req_033,Explain the concept of supply and demand in economics.
req_034,How do batteries store and release electrical energy?
req_035,What are the key features of sustainable agriculture?
req_036,Describe how fiber optic cables transmit data.
req_037,What is climate change and what causes it?
req_038,How do social media algorithms determine content feeds?
req_039,What are the benefits of meditation for mental health?
req_040,Explain how cryptocurrency transactions are verified.
req_041,What is gene therapy and how does it treat diseases?
req_042,How do wind turbines generate electrical power?
req_043,What are the main causes of air pollution in cities?
req_044,Describe the water filtration process in treatment plants.
req_045,How do 3D printers create three-dimensional objects?
req_046,What is telemedicine and how has it evolved recently?
req_047,Explain the importance of biodiversity in ecosystems.
req_048,How do electric car charging stations work?
req_049,What are the key components of a healthy diet?
req_050,Describe how satellite communication systems operate.
